{
  "$schema": "https://rave.maccrab.com/schemas/catalog-entry.json",
  "id": "com.maccrab.forensics.posture-pro",
  "display_name": "Mac Security Posture Pro",
  "short_description": "Grades the Mac's hardening state and flags unsigned launchd persistence + high-risk privacy-permission exposure. Read-only, network-denied, all-metadata.",
  "long_description": "A read-only security-posture collector. It probes the Mac's hardening controls and emits a single graded report plus per-control findings:\n\n\u2022 SIP, FileVault, Gatekeeper \u2014 the critical controls\n\u2022 Application Firewall (+ stealth mode)\n\u2022 XProtect malware-definition freshness\n\u2022 Download quarantine (LSQuarantine)\n\u2022 Launchd persistence integrity \u2014 resolves each LaunchDaemon/LaunchAgent program and code-signs it; flags unsigned / ad-hoc / unverifiable entries (the security payoff)\n\u2022 Privacy-permission exposure (TCC) \u2014 counts high-risk grants and lists the non-Apple bundle-ids holding them; never the grant bodies or TCC.db contents\n\nEmits verdicts, counts and paths only \u2014 no file contents, no secrets, no message/mail data. Score (0\u2013100) + letter grade is the headline.",
  "author": {
    "name": "MacCrab",
    "url": "https://maccrab.com"
  },
  "approved_at_commit": "0000000000000000000000000000000000000000",
  "approved_at_tag": "v0.1.0",
  "approved_by_review": [
    "maccrab-rave"
  ],
  "approved_at": "2026-06-17",
  "trust_tier": "first-party",
  "channel": "official",
  "runtime": "tierB",
  "signer_identity": "maccrab-rave:first-party",
  "signer_public_key_sha256": "07e39eb12c15b8052f5249134ea3337a0789ebc799d1c58d097aaa548a8aaae3",
  "current_version": "0.1.0",
  "release_url_template": "https://rave.maccrab.com/releases/{tag}/{file}",
  "manifest_path": "manifest.json",
  "kind": "collector",
  "privacy_class": "metadata",
  "requires_encrypted_scan": false,
  "tcc_requirements": [
    "kTCCServiceSystemPolicyAllFiles"
  ],
  "data_sources": [
    "SIP / FileVault / Gatekeeper / firewall state (system tools)",
    "XProtect bundle Info.plist",
    "LaunchDaemons / LaunchAgents plists + codesign verdicts",
    "TCC.db (summary counts + non-Apple client ids only)"
  ],
  "emits": [
    "posture.report",
    "posture.factor"
  ],
  "sample_output": [
    {
      "content_type": "posture.factor",
      "caption": "One emitted output line \u2014 an unsigned launchd persistence finding (the security payoff). Metadata only.",
      "example": "{\"kind\":\"artifact\",\"artifact\":{\"contentType\":\"posture.factor\",\"summary\":\"Launchd persistence integrity: fail\",\"privacyClass\":\"metadata\",\"confidence\":\"observed\",\"data\":{\"key\":\"persistence\",\"title\":\"Launchd persistence integrity\",\"status\":\"fail\",\"weight\":12,\"detail\":\"Scanned 10 launchd item(s); 1 unsigned / ad-hoc / script / unverifiable.\",\"remediation\":\"Investigate the flagged launchd entries \u2014 unsigned persistence is a common malware foothold.\",\"evidence\":[\"system-daemon: /Library/Application Support/Sketchy/helper [unsigned]\"]}}}"
    }
  ],
  "versions": {
    "0.1.0": {
      "tag": "v0.1.0",
      "source_commit": "0000000000000000000000000000000000000000",
      "artifact_sha256": "3a9e964854a076387a3213b1ef12fe4553793f11f35412163dc0a4c2dc9f65c9",
      "canonical_tree_sha256": "0241baddf7b52997d5b5db96d8cb21de613b4457188876add28a8b32064dfded",
      "manifest_sha256": "98aaae00dd6ceb70f9c46f7c5ebb503c6de0cfed92c1edae0523fdafad036eda",
      "signature_sha256": "6ed6fb14a053a8993a4bfa2c44fa94e05b6ad4297a169ab1e0eed894c3bd3d5e",
      "reproducibility": "verified",
      "vetting": {
        "automated_passes": [],
        "vetting_policy_commit": "policy@pre-release",
        "vetted_at": "2026-06-17T00:00:00Z"
      }
    }
  },
  "metadata": {
    "category": "system",
    "tags": [
      "posture",
      "collector",
      "hardening",
      "persistence"
    ],
    "min_maccrab_version": "1.19.0",
    "min_macos": "13.0"
  },
  "status": "active"
}
